{
  "$schema": "https://calm.finos.org/workshop/controls/permitted-connection.requirement.json",
  "control-id": "security-002",
  "name": "Permitted Connection",
  "description": "Permits a connection on a relationship specified in the architecture",
  "reason": "Required to enable flow between architecture components",
  "protocol": "HTTP"
}